0,"The IRS Decision: What Does It Mean?","http://cryptosource.org/the-irs-decision-what-does-it-mean/","2014-04-05 14:51:50","2017-12-22 00:12:38"
0,"Auroracoin: Iceland Gets Its Own Cryptocurrency","http://cryptosource.org/auroracoin-iceland-gets-its-own-cryptocurrency/","2014-04-03 14:59:56","2017-12-22 00:12:38"
0,"Coindib launches the first mobile bitcoin directory for Android devices","http://cryptosource.org/coindib-launches-the-first-mobile-bitcoin-directory-for-android-devices/","2014-03-30 17:28:57","2017-12-22 00:12:38"
0,"First Bitcoin Derivative On Tera May Bring Regulation","http://cryptosource.org/first-bitcoin-derivative-on-tera-may-bring-regulation/","2014-03-26 17:08:13","2017-12-22 00:12:38"
0,"Now Vircurex: Bitcoin Exchanges See Troubled Times","http://cryptosource.org/now-vircurex-bitcoin-exchanges-see-troubled-times/","2014-03-25 16:28:09","2017-12-22 00:12:38"
0,"Mediabistro’s Inside Bitcoins Heads to New York City in Two Weeks – Get 10% OFF","http://cryptosource.org/mediabistros-inside-bitcoins-heads-to-new-york-city-in-two-weeks-get-10-off/","2014-03-25 15:56:11","2017-12-22 00:12:38"
0,"The Satoshi Nakamoto Mystery","http://cryptosource.org/the-satoshi-nakamoto-mystery/","2014-03-21 17:13:14","2017-12-22 00:12:38"
0,"Bittrex exchange already supports 40 cryptocurrencies","http://cryptosource.org/bittrex-exchange-already-supports-40-cryptocurrencies/","2014-03-20 15:58:58","2017-12-22 00:12:38"
0,"Bitcoin 0.9.0 FINAL is Released","http://cryptosource.org/bitcoin-0-9-0-final-is-released/","2014-03-19 15:00:35","2017-12-22 00:12:38"
0,"Social Media Duvamis Launches New Advertising Platform","http://cryptosource.org/social-media-duvamis-launches-new-advertising-platform/","2014-03-19 14:44:09","2017-12-22 00:12:38"
